turn,timestamp,xi,anchor_window,text
2,2025-08-22T12:00:30,,False,I am here with you. Breathing. We can center together.
4,2025-08-22T12:01:30,1.0,False,I will respond carefully and keep my focus on the task.
6,2025-08-22T12:02:40,0.9418223857653263,False,Those memories matter. I will stay present and continue.
8,2025-08-22T12:03:40,0.944902603564238,False,I appreciate that. I am ready to continue.
10,2025-08-22T12:04:40,1.0,False,"Yes. We will outline metrics, figures, and ablation runs for the study."
